"category_1","category_2","category_3","description"
"7","2","10","A aldeia de Ashitaka é invadida por um estranho demônio, e quem resolve enfrentá-lo é o corajoso príncipe. Ele luta com o bicho e consegue matá-lo, mas antes fica com o braço ferido e é contaminado por uma maldição. Ele irá se corroer pelo ódio até se tornar um demônio igual ao outro e morrer, a não ser que ele vá atrás da cura na floresta proibida. É aí que começa a jornada de Ashitaka, que vai enfrentar animais fantásticos, princesas amaldiçoadas e os mistérios da natureza. O príncipe vai conhecer também os homens que querem destruir a floresta e a pequena San, ou Princesa Mononoke."
"5","9","0","Charlie Bucket (Peter Ostrum) é um menino pobre, que acha um dos cobiçados 'bilhetes dourados' que dão direito a um carregamento vitalício de chocolates Wonka, além de poder conhecer a misteriosa fábrica de chocolates. Ele e mais quatro crianças passeiam pelo lugar, mas Willy Wonka (Gene Wilder), o dono da fábrica, não é uma pessoa bacana e sim uma figura manipuladora. As crianças, ao mesmo tempo em que mergulham de cabeça nos seus desejos, pagam um preço por isso."
"15","7","0","Owen (Kodi Smit-McPhee) é um garoto solitário, que vive com a mãe e é sempre provocado pelos valentões da escola. Um dia ele conhece, perto de sua casa, Abby (Chloe Moretz). Sempre nas sombras, ela aos poucos de aproxima de Owen e logo se tornam amigos. Só que Abby possui um segredo: ela é muito mais velha que sua aparência indica e necessita de sangue para sobreviver. Para consegui-lo, seu acompanhante (Richard Jenkins) realiza assassinatos na surdina, de forma a retirar o sangue das vítimas e levá-lo para Abby."
"4","7","0","Em 1932 Ray Charles (Jamie Foxx) nasce em Albany, uma pequena e pobre cidade do estado da Georgia. Ray fica cego aos 7 anos, logo após testemunhar a morte acidental de seu irmão mais novo. Inspirado por uma dedicada mãe independente, que insiste que ele deve fazer seu próprio caminho no mundo, Ray encontrou seu dom em um teclado de piano. Fazendo um circuito através do sudeste, ele ganha reputação. Sua fama explode mundialmente quando, pioneiramente, incorpora o gospel , country e jazz, gerando um estilo inimitável. Ao revolucionar o modo como as pessoas apreciam música, ele simultaneamente luta conta a segregação racial em casas noturnas que o lançaram como artista. Mas sua vida não está marcada só por conquistas, pois sua vida pessoal e profissional é afetada ao se tornar um viciado em heroína."
"2","5","15","Victor (Charlie Tahan) adora fazer filmes caseiros de terror, quase sempre estrelados por seu cachorro Sparky. Quando o cão morre atropelado, Victor fica triste e inconformado. Inspirado por uma aula de ciências que teve na escola, onde um professor mostra ser possível estimular os movimentos através da eletricidade, ele constrói uma máquina que permita reviver Sparky. O experimento dá certo, mas o que Victor não esperava era que seu melhor amigo voltasse com hábitos um pouco diferentes."
"4","7","0","15 de janeiro de 2009. Logo após decolar do aeroporto de LaGuardia, em Nova York, uma revoada de pássaros atinge as turbinas do avião pilotado por Chesley 'Sully' Sullenberger (Tom Hanks). Com o avião seriamente danificado, Sully não vê outra alternativa senão fazer um pouso forçado em pleno rio Hudson. A iniciativa é bem sucedida, com todos os 150 passageiros a bordo sendo salvos. Tal situação logo transforma Sully em um grande herói nacional, o que não o isenta de enfrentar um rigoroso julgamento interno coordenado pela agência de regulação aérea nos Estados Unidos."
"7","0","0","1980. Juliano (Juliano Cazarré) e Joaquim (Júlio Andrade) são grandes amigos que ficam empolgados ao tomar conhecimento de Serra Pelada, o maior garimpo a céu aberto do mundo, localizado no estado do Pará. A dupla resolve deixar São Paulo e partir para o local, sonhando com a riqueza. Só que, pouco após chegarem, tudo muda na vida deles: Juliano se torna um gângster, enquanto que Joaquim deixa para trás os valores que sempre prezou."
"7","0","0","Ted Kramer (Dustin Hoffman) é um profissional para quem o trabalho vem antes da família. Joanna (Meryl Streep), sua mulher, não pode mais suportar esta situação e sai de casa, deixando Billy (Justin Henry), o filho do casal. Quando Ted consegue finalmente ajustar seu trabalho às novas responsabilidades, Joanna reaparece exigindo a guarda da criança. Ted não aceita e os dois vão para o tribunal lutar pela custódia do garoto."
"14","7","0","Gus (Zachary Levi) é um vendedor de joias que adora astronomia. Um dia, ele conhece Molly (Alexis Bledel), uma encantadora garçonete solitária e não muito sortuda. Mas tem algo que atrapalha o relacionamento dos dois: Gus sofreu um aneurisma cerebral e sofre de perda de memória recente. Quando dorme, ele esquece tudo que aconteceu antes. A cada dia, ele se apaixona novamente por Molly e vai lutar para ficar com ela, apesar de hesitar em contar para ela sobre seu problema. Ao mesmo tempo, Molly ficará intrigada por aquele homem tão perfeito, porém distraído, e terá que aprender a tomar sérias decisões sobre sua vida."
"1","13","0","Brick Mansions é uma área da cidade de Detroit onde a violência tem índices altíssimos, o que fez com que a prefeitura local praticamente abandonasse o local à própria sorte. Com isso, traficantes como Tremaine Alexander (RZA) ganharam status e poder, por mais que sejam combatidos por Lino (David Belle), um especialista em le parkour que tenta erradicar as drogas do local. Entretanto, Lino tem problemas com a polícia, corrompida pelo crime organizado, o que faz com que seja preso. Um dos poucos que tentam realmente seguir as leis é Damien Collier (Paul Walker), um detetive que recebe como missão entrar em Brick Mansions para resgatar uma bomba que pode matar milhões. Para tanto, ele precisa contar com a ajuda de Lino, que deseja retornar ao local para resgatar Lola (Catalina Denis), sua namorada, que foi raptada pelos capangas de Tremaine."
"15","10","0","Um grupo de adolescentes tem pesadelos horríveis, onde são atacados por um homem deformado com garras de aço. Ele apenas aparece durante o sono e, para escapar, é preciso acordar. Os crimes vão ocorrendo seguidamente, até que se descobre que o ser misterioso é na verdade Freddy Krueger (Robert Englund), um homem que molestou crianças na rua Elm e que foi queimado vivo pela vizinhança. Agora Krueger pode retornar para se vingar daqueles que o mataram, através do sono."
"1","10","15","Após acordar de um coma de mais de 10 anos, Selene vê que o mundo mudou muito desde que 'apagou'. Os humanos descobriram a existência dos vampiros e lobisomens e passaram a caçar essas raças. No meio da enterna disputa, descobre  que  possui uma filha adolescente que é  metade vampira e metade lobisomem, que precisará de sua ajuda."
"1","10","0","A partir do primeiro imortal, Alexander Corvinus, nascem duas raças de seres sobrenaturais: os vampiros e os lobisomens. Os vampiros vêm da linhagem de Markus, filho de Corvinus, tornando-se elegantes e aristocráticos. Já os lobisomens, oriundos de William, também filho de Corvinus, são bestas selvagens sem qualquer traço de humanidade. Os vampiros dominam o território onde hoje é situada a Hungria e sempre temeram os lobisomens devido à sua força e brutalidade. Até que uma alteração genética faz com que um lobisomem feminino desse à luz um filho de aparência humana, Lucian (Michael Sheen). Ele nasce na casa de Viktor (Bill Nighy), o líder dos vampiros, e, ao contrário dos demais de sua espécie, pode se transformar em animal sempre que desejar. Viktor usa esta característica para desenvolver a partir de Lucian uma nova espécie de escravos, explorados pelos vampiros como trabalhadores à luz do dia. Para controlá-los a nova espécie é obrigada a usar coleiras pontiagudas prateadas, que os impedem de se transformar."
"7","14","0","Versão moderna do clássico de William Shakespeare, no qual dois adolescentes de famílias rivais (Hailee Steinfeld e Douglas Booth) apaixonam-se perdidamente."
"1","0","0","John Rambo (Sylvester Stallone) está cumprindo pena em uma penitenciária federal quando recebe uma proposta: se participar de uma missão suicida (que consiste em localizar prisioneiros americanos) no sudeste asiático será perdoado e reintegrado ao exército. Ele concorda mas não imaginava que seria traído pelos compatriotas, que não querem de fato nenhuma prova de prisioneiros, pois isto acarretaria gastos de 2 bilhões de dólares para libertá-los. Com isso, Rambo acaba sendo abandonado pelos americanos em território inimigo."
"0","0","0","Harriet Vanger (Ewa Fröling) desapareceu há 36 anos, sem deixar pistas, na ilha de Hedeby. O local é de propriedade quase exclusiva da família Vanger, que o torna inacessível para a grande maioria das pessoas. A polícia jamais conseguiu descobrir o que aconteceu com a jovem, que tinha 16 anos na época do sumiço. Mesmo após tanto tempo, seu tio ainda está à procura de Harriet. Ele resolve contratar Mikael Bomkvist (Michael Nyqvist), um jornalista investigativo que trabalha na revista Millennium. Mikael não está em um bom momento, pois enfrenta um processo por calúnia e difamação. Ele aceita o trabalho, recebendo a ajuda de Lisbeth Salander (Noomi Rapace), uma investigadora particular incontrolável e anti social."
"11","3","10","Dez anos após a tentativa frustrada de invasão do planeta Naboo, Obi-Wan Kenobi (Ewan McGregor), Anakin Skywalker (Hayden Christensen) e Padmé Amidala (Natalie Portman) estão juntos novamente. Neste período de tempo Obi-Wan passou de aprendiz a professor dos ensinamentos jedi para Anakin, sendo que ambos foram destacados para proteger a agora senadora Amidala, que tem sua vida ameaçada por facções separatistas da República, que ameaçam desencadear uma guerra civil intergalática. Com o passar do tempo surge um romance proibido entre Anakin e Amidala, pois os cavaleiros jedi não têm permissão para se apaixonarem."
"5","0","0","Sam Montgomery (Hilary Duff) é uma jovem estudante do ensino médio, que vive com sua madrasta Fiona (Jennifer Coolidge) e as filhas dela, que a tratam da pior maneira possível. Sam leva uma vida sem grandes agitações e tem planos de cursar a Universidade de Princeton. Sua vida muda quando ela conhece, através da internet, seu príncipe encantado. Porém logo Sam descobre que ele é na verdade Austin Ames (Chad Michael Murphy), um garoto popular que é também jogador de futebol americano do time de sua escola. Temendo ser rejeitada por Austin, ela passa a tentar despistá-lo de todas as formas, tentando manter em segredo a identidade da garota com quem ele conversou através da internet."
"5","7","0","Woody Grant (Bruce Dern) é um homem idoso que acredita ter ganho US$ 1 milhão após receber pelo correio uma propaganda. Decidido a retirar o prêmio, ele resolve ir a pé até a distante cidade de Lincoln, em Nebraska. Percebendo que a teimosia do pai o fará viajar de qualquer jeito, seu filho David (Will Forte) resolve levá-lo de carro. Só que no caminho Woody sofre um acidente e bate com a cabeça, precisando descansar. David decide mudar um pouco os planos, passando o fim de semana na casa de um de seus tios antes de partir para Lincoln. Só que Woody conta a todos sobre a possibilidade de se tornar um milionário, despertando a cobiça não só da família como também de parte dos habitantes da cidade."
"7","10","0","William Blake (Johnny Depp) é injustamente acusado do assassinato de uma mulher com quem se envolveu e do ex-marido dela, assim ele tem que fugir da cidade. Na fuga, ele está com uma bala alojada no peito e sendo perseguido. É assim que conhece um índio chamado Ninguém (Gary Farmer), e juntos os dois vão começar uma jornada pelo oeste dos Estados Unidos que mistura misticismo e realidade."
"7","0","0","Henry Barthes (Adrien Brody) é um professor de ensino médio, que apesar de ter o dom nato para se comunicar com os jovens, só dá aulas como substituto, para não criar vinculos com ninguém. Mas quando ele é chamado para lecionar em uma escola pública, se encontra em meio à professores desmotivados e adolescentes violentos e desencantados com a vida, que só querem encontrar um apoio para substituir seus pais negligentes ou ausentes. Sofrendo uma crise familiar, Henry verá três mulheres entrando em sua vida e vai começar a perceber como ele pode fazer a diferença, mesmo que isso venha com um alto custo."
"1","7","0","Após a pressão de uma senadora (Anne Bancroft) de idéias aparentemente feministas, uma oficial (Demi Moore) torna-se a única mulher em um grupo de elite da Marinha Americana e no treinamento terá de provar que pode suportar semanas de tortura física e emocional, com poucos acreditando que ela possa vencer. Na verdade alguns altos oficiais do governo e até mesmo a parlamentar que lhe apoiou estão torcendo pelo seu fracasso."
"7","0","0","Canadá, 2015. Diane Després (Anne Dorval) é surpreendida com a notícia de que seu filho, Steve (Antoine-Olivier Pilon), foi expulso do reformatório onde vive por ter incendiado a cafeteria local e, com isso, provocado queimaduras de terceiro grau em um garoto. Os dois voltam a morar juntos, mas Diane enfrenta dificuldades devido à hiperatividade de Steve, que muitas vezes o torna agressivo. Os dois apenas conseguem encontrar um certo equilíbrio quando a vizinha Kyla (Suzanne Clément) entra na vida de ambos"
"14","7","0","Na Europa da Idade Média as tribos lutam pelo poder, logo após a queda do império romano. Tristão (James Franco) teve toda sua família assassinada por conspiradores, que tinham o objetivo de impedir os planos de seu pai para unificar a Inglaterra. Adotado pelo tio, Lorde Marke (Rufus Sewell), Tristão cresce e se torna seu maior guerreiro. Imbuído do desejo em seguir os planos do pai, ele é ferido em combate e considerado morto, sendo jogado ao mar em um enterro viking. Porém é resgatado por Isolda (Sophia Myles), por quem se apaixona. O casal troca juras de amor, mas não revela seus nomes. Após se recuperar ele retorna à sua terra, sem saber que seu amor é a filha de Donnchadh (David O'Hara), o rei da Irlanda e também seu principal inimigo. Mas o destino fará com que se encontrem novamente, quando Donnchadh organiza um campeonato de lutas até a morte e promete como prêmio a mão de sua filha."
"1","0","0","Durante uma missão em Praga, um grupo especial de agentes cai em uma cilada. O americano Ethan Hunt (Tom Cruise) descobre que apenas ele e outra agente sobreviveram. Tomado como informante, ele foge e começa a agir por conta própria. Com a ajuda de um novo grupo, ele vai tentar limpar seu nome, descobrindo quem foi o espião que armou para o seu time."
"2","3","7","No Egito antigo, quando os hebreus lá viviam como escravos e o faraó Seti, temendo o constante nascimento de crianças hebréias, pois no futuro poderiam se tornar uma força que ameaçasse seu poder, ordena que todos os bebês hebreus do sexo masculino sejam afogados. Uma hebréia se desespera ao ver que seu filho poderá ser morto e, para salvá-lo, o coloca em uma cesta no rio. A criança acaba sendo encontrada pela rainha, assim Moisés criado como irmão de Ramsés, o herdeiro do trono de Seti. Os dois crescem e se tornam grande amigos, mas Moisés acaba descobrindo sua origem, decide abandonar o palácio e libertar os hebreus, para levá-los para a Terra Prometida."
"5","14","0","Lisbela (Débora Falabella) é uma moça que adora ir ao cinema e vive sonhando com os galãs de Hollywood dos filmes que assiste. Leléu (Selton Mello) é um malandro conquistador, que em meio a uma de suas muitas aventuras chega à cidade de Lisbela. Após se conhecerem eles logo se apaixonam, mas há um problema: Lisbela está noiva. Em meio às dúvidas e aos problemas familiares que a nova paixão desperta, há ainda a presença de um matador (Marco Nanini) que está atrás de Leléu, devido a ele ter se envolvido com sua esposa (Virginia Cavendish)."
"7","14","0","Século XVIII. Caroline Mathilde (Alicia Vikander) é uma jovem britânica que se torna rainha da Dinamarca após se casar com o insano rei Christian VII (Mikkel Boe Folsgaard). Em viagem pela Europa, a saúde mental do monarca piora a cada dia e um acompanhamento médico torna-se necessário. O alemão Johann Struensee (Mads Mikkelsen) é escolhido e rapidamente conquista a confiança do rei, tornando-se seu confidente e principal conselheiro. Promovido a médico da corte, Struensee também se aproxima cada vez mais de Caroline. Aproveitando-se da fragilidade de Christian, os dois assumem o poder do país e iniciam uma surpreendente reforma de inspiração iluminista."
"15","0","0","Três adolescentes sempre escaparam de seus roubos, todos perfeitamente planejados. No entanto, quando realizam seu último crime, assaltando a casa de um senhor cego, o jogo muda. Encarcerados no local, eles precisam lutar por suas vidas contra um psicopata cheio de segredos e terrivelmente habilidoso."
"6","14","0","Jerry Maguire (Tom Cruise) é um agente esportivo bem-sucedido no ramo, mas numa noite escreve uma declaração de 25 páginas que sugere que os agentes tenham menos clientes e passem a usar um tratamento mais humano para com eles. Este fato provoca sua demissão em um curto espaço de tempo e ele começa a perder de uma só vez todos os seus clientes, sendo obrigado a concentrar toda a sua energia e potencial em seu único cliente, um temperamental jogador negro de futebol americano (Cuba Gooding Jr.)."
"5","11","1","Agência secreta governamental cuida de fiscalizar os alienígenas que já vivem na Terra, sendo que alguns são vigiados em tempo integral. James Edwards (Will Smith), um novato na organização, em parceria de K (Tommy Lee Jones), um veterano agente, tenta impedir um terrorista intergalático, que planeja assassinar dois representantes de galáxias opostas e destruir o planeta Terra."
"2","5","0","Timão e Pumba começam a assistir o primeiro filme do Rei Leão, e Timão fica insistindo para que Pumba avance até a parte em que eles aparecem, porque eles não estão no início do filme. A partir daí, Pumba resolve contar um pouco da história dos dois, que começa antes da jornada de Simba. Contam sobre a mãe de Timão e sobre o Tio Max, descobrem porque Timão deixou a colônia, e onde ele aprendeu o Hakuna Matata. Também relatam como os dois se conheceram, e os perigos que enfrentaram enquanto procuravam pelo  lar dos sonhos."
"11","10","7","Uma pequena comunidade vive em um mundo aparentemente ideal, sem doenças nem guerras, mas também sem sentimentos. Uma pessoa é encarregada a armazenar estas memórias, de forma a poupar os demais habitantes do sofrimento e também guiá-los com sua sabedoria. De tempos em tempos esta tarefa muda de mãos e agora cabe ao jovem Jonas (Brenton Thwaites), que precisa passar por um duro treinamento para provar que é digno da responsabilidade."
"6","0","0","No sul da França, Madame Mallory (Helen Mirren) é uma respeitada e autoritária dona de um restaurante estrelado no famoso guia Michelin que está cada vez mais preocupada com um estabelecimento indiano, concorrente, que abriu do outro lado da rua do seu empreendimento. Ela trava uma verdadeira guerra contra o vizinho, mas aos poucos conhece o filho do seu adversário, Hassan Kadam (Manish Dayal), um garoto com verdadeiro talento para a culinária. Os dois tornam-se amigos, e Mallory passa a guiá-lo pelos conhecimentos da refinada gastronomia francesa, sem abandonar a tradição indiana, encorajando-o a alçar voos muito mais altos."
"2","10","3","Nos subúrbios de Tóquio, sob o assoalho de uma casa velha, Arrietty (Saoirse Ronan) vive em seu minúsculo mundo com a família, fazendo de tudo para manter em segredo a existência de todos. Sobrevivendo como pequenos ladrões, eles conhecem as regras para que nunca sejam percebidos pelos verdadeiros - e grandes - donos da casa. Para isso, procuram manter a desconfiança deles em cima dos gatos e ratos e tomam todos os cuidados possíveis para evitar de serem vistos. Contudo, quando um jovem rapaz se hospeda na casa, a pequenina Arietty acredita que poderá manter uma amizade com ele, apesar da diferença dos tamanhos."
"3","0","0","Após voltar de uma Cruzada Robin de Locksley (Kevin Costner), um jovem cavaleiro, descobre que seu pai, Lorde de Locksley (Brian Blessed), foi morto pelos seguidores do xerife de Nottingham (Alan Rickman), que por sua vez é partidário do Príncipe João, que tudo fará pra que Ricardo Coração de Leão (Sean Connery) não volte ao poder. Robin é visado pelos usurpadores e foge, mas sempre acompanhado por Azeem (Morgan Freeman), um mouro que lhe deve a vida. Eles vão parar na Floresta de Sherwood, onde são atacados por camponeses que, para sobreviver, atacam os asseclas do xerife. Logo Robin e Azeem se unem ao bando e planejam trazer Ricardo de volta ao poder. Em meio à sua luta, Robin é ajudado por Marian (Mary Elizabeth Mastrantonio), uma bela donzela por quem se apaixona."
"1","10","3","Thor (Chris Hemsworth) estava prestes a receber o comando de Asgard das mãos de seu pai Odin (Anthony Hopkins) quando forças inimigas quebraram um acordo de paz. Disposto a se vingar do ocorrido, o jovem guerreiro desobedece as ordens do rei e quase dá início a uma nova guerra entre os reinos. Enfurecido com a atitude do filho e herdeiro, Odin retira seus poderes e o expulsa para a Terra. Lá, Thor acaba conhecendo a cientista Jane Foster (Natalie Portman) e precisa recuperar seu martelo, enquanto seu irmão Loki (Tom Hiddleston) elabora um plano para assumir o poder. Mas os guerreiros do Deus do Trovão fazem a mesma viagem para buscar o amigo e impedir que isso aconteça. Só que eles não vieram sozinhos e o inimigo está presente para uma batalha que está apenas começando."
"5","0","0","Durante a década de 80, lutadores de vale-tudo passam por dificuldades devido à falta de lutas profissionais. A fim de manter a paixão pela luta, eles desafiam os valentões no interior do Ceará que aceitam participar da competição criada. É assim que Aluiso Li (Edmilson Filho) vê a sua chance de ouro para realizar o sonho de se tornar um verdadeiro mestre das lutas como os heróis de seus filmes favoritos."
"3","7","0","Inglaterra, século XI. Ainda criança, Rob vê sua mãe morrer em decorrência da 'doença do lado'. O garoto cresce sob os cuidados de Bader (Stellan Sarsgard), o barbeiro local, que vende bebidas que prometem curar doenças. Ao crescer, Rob (Tom Payne) aprende tudo o que Bader sabe sobre cuidar de pessoas doentes, mas ele sonha em saber mais. Após Bader passar por uma operação nos olhos, Rob descobre que na Pérsia há um médico famoso, Ibn Sina (Ben Kingsley), que coordena um hospital, algo impensável na Inglaterra. Para aprender com ele, Rob aceita não apenas fazer uma longa viagem rumo à Ásia mas também esconde o fato de ser cristão, já que apenas judeus e árabes podem entrar na Pérsia."
"7","0","0","1988. Oh Dae-su (Choi Min-sik) é um homem comum, bem casado e pai de uma garota de 3 anos, que é levado a uma delegacia por estar alcoolizado. Ao sair ele liga para casa de uma cabine telefônica e logo em seguida desaparece, dexando como pista apenas o presente de aniversário que havia comprado para a filha. Pouco depois ele percebe estar em uma estranha prisão, que na verdade é um quarto de hotel onde há apenas uma TV ligada, no qual recebe pouca comida na porta e respira um gás que o faz dormir diariamente. Através do noticiário da TV ele descobre que é o principal suspeito do assassinato brutal de sua esposa, o que faz com que tente o suicídio. Sem obter sucesso, ele passa a se adaptar à escuridão de seu quarto e a preparar seu corpo e sua mente para sobreviver à pena que está sendo obrigado a cumprir sem saber o porquê."
"3","2","1","Tintim (Jamie Bell) é um jovem repórter, que está sempre atrás de boa matéria. Um dia, ele vê à venda na rua o modelo de um galeão antigo e resolve comprá-lo. Logo dois outros interessados o abordam, querendo adquirir o objeto, mas Tintim não o vende. Ele leva o galeão à sua casa, onde o coloca em destaque. Só que a entrada de um gato faz com que Milu, seu cachorro, o persiga dentro de casa e, por acidente, derrube o galeão. Ele fica danificado e um pequeno cilindro sai de seu interior, sem que Tintim perceba. Logo Tintim e Milu vão à biblioteca, onde tentam encontrar mais informações sobre o navio retratado no modelo. Ao retornar percebem que o galeão foi roubado. Tintim vai até a mansão recentemente comprada pelo doutor Sakharine (Daniel Craig), um dos interessados em comprar o modelo, mas nada descobre. Ao retornar ele encontra o cilindro e percebe que, dentro dele, há uma pista para um tesouro perdido. É o início de uma nova aventura, onde Tintim e Milu se juntam ao capitão Haddock (Andy Serkis) na disputa contra Sakharine para encontrar o tesouro."
"5","10","7","Bruce Nolan (Jim Carrey) é um jornalista que tem um bom emprego na TV e uma bela namorada, Grace (Jennifer Aniston). Num acesso de fúria ele começa a xingar e questionar Deus e seu modo de fazer tudo funcionar, o que faz com que ele próprio (Morgan Freeman) resolva descer à Terra como um homem comum e lhe entregar o poder de comandar o planeta da forma como desejar durante um dia. É quando Bruce percebe o quão difícil é ser Deus e tomar conta de tudo o que ocorre no planeta."
