"category_1","category_2","category_3","description"
"13","7","0","Don Vito Corleone (Marlon Brando) é o chefe de uma 'família' de Nova York que está feliz, pois Connie (Talia Shire), sua filha, se casou com Carlo (Gianni Russo). Porém, durante a festa, Bonasera (Salvatore Corsitto) é visto no escritório de Don Corleone pedindo 'justiça', vingança na verdade contra membros de uma quadrilha, que espancaram barbaramente sua filha por ela ter se recusado a fazer sexo para preservar a honra. Vito discute, mas os argumentos de Bonasera o sensibilizam e ele promete que os homens, que maltrataram a filha de Bonasera não serão mortos, pois ela também não foi, mas serão severamente castigados. Vito porém deixa claro que ele pode chamar Bonasera algum dia para devolver o 'favor'. Do lado de fora, no meio da festa, está o terceiro filho de Vito, Michael (Al Pacino), um capitão da marinha muito decorado que há pouco voltou da 2ª Guerra Mundial. Universitário educado, sensível e perceptivo, ele quase não é notado pela maioria dos presentes, com exceção de uma namorada da faculdade, Kay Adams (Diane Keaton), que não tem descendência italiana mas que ele ama. Em contrapartida há alguém que é bem notado, Johnny Fontane (Al Martino), um cantor de baladas românticas que provoca gritos entre as jovens que beiram a histeria. Don Corleone já o tinha ajudado, quando Johnny ainda estava em começo de carreira e estava preso por um contrato com o líder de uma grande banda, mas a carreira de Johnny deslanchou e ele queria fazer uma carreira solo. Por ser seu padrinho Vito foi procurar o líder da banda e ofereceu 10 mil dólares para deixar Johnny sair, mas teve o pedido recusado. Assim, no dia seguinte Vito voltou acompanhado por Luca Brasi (Lenny Montana), um capanga, e após uma hora ele assinou a liberação por apenas mil dólares, mas havia um detalhe: nas 'negociações' Luca colocou uma arma na cabeça do líder da banda. Agora, no meio da alegria da festa, Johnny quer falar algo sério com Vito, pois precisa conseguir o principal papel em um filme para levantar sua carreira, mas o chefe do estúdio, Jack Woltz (John Marley), nem pensa em contratá-lo. Nervoso, Johnny começa a chorar e Vito, irritado, o esbofeteia, mas promete que ele conseguirá o almejado papel. Enquanto a festa continua acontecendo, Don Corleone comunica a Tom Hagen (Robert Duvall), seu filho adotivo que atua como conselheiro, que Carlo terá um emprego mas nada muito importante, e que os 'negócios' não devem ser discutidos na sua frente. Os verdadeiros problemas começam para Vito quando Sollozzo (Al Lettieri), um gângster que tem apoio de uma família rival, encabeçada por Phillip Tattaglia (Victor Rendina) e seu filho Bruno (Tony Giorgio). Sollozzo, em uma reunião com Vito, Sonny e outros, conta para a família que ele pretende estabelecer um grande esquema de vendas de narcóticos em Nova York, mas exige permissão e proteção política de Vito para agir. Don Corleone odeia esta idéia, pois está satisfeito em operar com jogo, mulheres e proteção, mas isto será apenas a ponta do iceberg de uma mortal luta entre as 'famílias'."
"7","12","4","A inusitada história de Oskar Schindler (Liam Neeson), um sujeito oportunista, sedutor, 'armador', simpático, comerciante no mercado negro, mas, acima de tudo, um homem que se relacionava muito bem com o regime nazista, tanto que era membro do próprio Partido Nazista (o que não o impediu de ser preso algumas vezes, mas sempre o libertavam rapidamente, em razão dos seus contatos). No entanto, apesar dos seus defeitos, ele amava o ser humano e assim fez o impossível, a ponto de perder a sua fortuna mas conseguir salvar mais de mil judeus dos campos de concentração."
"10","3","1","Sauron planeja um grande ataque a Minas Tirith, capital de Gondor, o que faz com que Gandalf (Ian McKellen) e Pippin (Billy Boyd) partam para o local na intenção de ajudar a resistência. Um exército é reunido por Theoden (Bernard Hill) em Rohan, em mais uma tentativa de deter as forças de Sauron. Enquanto isso Frodo (Elijah Wood), Sam (Sean Astin) e Gollum (Andy Serkins) seguem sua viagem rumo à Montanha da Perdição, para destruir o Um Anel."
"7","0","0","Em 1946, Andy Dufresne (Tim Robbins), um jovem e bem sucedido banqueiro, tem a sua vida radicalmente modificada ao ser condenado por um crime que nunca cometeu, o homicídio de sua esposa e do amante dela. Ele é mandado para uma prisão que é o pesadelo de qualquer detento, a Penitenciária Estadual de Shawshank, no Maine. Lá ele irá cumprir a pena perpétua. Andy logo será apresentado a Warden Norton (Bob Gunton), o corrupto e cruel agente penitenciário, que usa a Bíblia como arma de controle e ao Capitão Byron Hadley (Clancy Brown) que trata os internos como animais. Andy faz amizade com Ellis Boyd Redding (Morgan Freeman), um prisioneiro que cumpre pena há 20 anos e controla o mercado negro da instituição."
"2","3","9","Mufasa (voz de James Earl Jones), o Rei Leão, e a rainha Sarabi (voz de Madge Sinclair) apresentam ao reino o herdeiro do trono, Simba (voz de Matthew Broderick). O recém-nascido recebe a bênção do sábio babuíno Rafiki (voz de Robert Guillaume), mas ao crescer é envolvido nas artimanhas de seu tio Scar (voz de Jeremy Irons), o invejoso e maquiavélico irmão de Mufasa, que planeja livrar-se do sobrinho e herdar o trono."
"13","7","0","Início do século XX. Após a máfia local matar sua família, o jovem Vito (Robert De Niro) foge da sua cidade na Sicília e vai para a América. Já adulto em Little Italy, Vito luta para ganhar a vida (legal ou ilegalmente) e manter sua esposa e filhos. Ele mata Black Hand Fanucci (Gastone Moschin), que exigia dos comerciantes uma parte dos seus ganhos. Com a morte de Fanucci, o poderio de Vito cresce muito, mas sua família é o que mais importa para ele. Um legado de família que vai até os enormes negócios que nos anos 50 são controlados pelo caçula, Michael Corleone (Al Pacino). Agora baseado em Lago Tahoe, Michael planeja fazer incursões em Las Vegas e Havana instalando negócios ligados ao lazer, mas descobre que aliados como Hyman Roth (Lee Strasberg) estão tentando matá-lo. Crescentemente paranoico, Michael também descobre que sua ambição acabou com seu casamento com Kay (Diane Keaton) e até mesmo seu irmão Fredo (John Cazale) o traiu. Escapando de uma acusação federal, Michael concentra sua atenção para lidar com os seus inimigos."
"7","5","12","Durante a Segunda Guerra Mundial na Itália, o judeu Guido (Roberto Benigni) e seu filho Giosué são levados para um campo de concentração nazista. Afastado da mulher, ele tem que usar sua imaginação para fazer o menino acreditar que estão participando de uma grande brincadeira, com o intuito de protegê-lo do terror e da violência que os cercam."
"6","14","0","Quarenta anos da história dos Estados Unidos, vistos pelos olhos de Forrest Gump (Tom Hanks), um rapaz com QI abaixo da média e boas intenções. Por obra do acaso, ele consegue participar de momentos cruciais, como a Guerra do Vietnã e Watergate, mas continua pensando no seu amor de infância, Jenny Curran."
"1","0","0","Após os acontecimentos em Londres, Dom (Vin Diesel), Brian (Paul Walker), Letty (Michelle Rodriguez) e o resto da equipe tiveram a chance de voltar para os Estados Unidos e recomeçarem suas vidas. Mas a tranquilidade do grupo é destruída quando Deckard Shaw (Jason Statham), um assassino profissional, quer vingança pela morte de seu irmão. Agora, a equipe tem que se reunir para impedir este novo vilão. Mas dessa vez, não é só sobre ser veloz. A luta é pela sobrevivência."
"10","13","0","1935, no corredor da morte de uma prisão sulista. Paul Edgecomb (Tom Hanks) é o chefe de guarda da prisão, que temJohn Coffey (Michael Clarke Duncan) como um de seus prisioneiros. Aos poucos, desenvolve-se entre eles uma relação incomum, baseada na descoberta de que o prisioneiro possui um dom mágico que é, ao mesmo tempo, misterioso e milagroso."
"10","3","0","Harry Potter (Daniel Radcliffe) e seus amigos Rony Weasley (Rupert Grint) e Hermione Granger (Emma Watson) seguem à procura das horcruxes. O objetivo do trio é encontrá-las e, em seguida, destruí-las, de forma a eliminar lorde Voldemort (Ralph Fiennes) de uma vez por todas. Com a ajuda do duende Grampo (Warwick Davis), eles entram no banco Gringotes de forma a invadir o cofre de Bellatrix Lestrange (Helena Bonham Carter). De lá retornam ao castelo de Hogwarts, onde precisam encontrar mais uma horcrux. Paralelamente, Voldemort prepara o ataque definitivo ao castelo."
"1","7","0","Após dois anos desde o surgimento do Batman (Christian Bale), os criminosos de Gotham City têm muito o que temer. Com a ajuda do tenente James Gordon (Gary Oldman) e do promotor público Harvey Dent (Aaron Eckhart), Batman luta contra o crime organizado. Acuados com o combate, os chefes do crime aceitam a proposta feita pelo Coringa (Heath Ledger) e o contratam para combater o Homem-Morcego."
"10","3","1","Numa terra fantástica e única, chamada Terra-Média, um hobbit (seres de estatura entre 80 cm e 1,20 m, com pés peludos e bochechas um pouco avermelhadas) recebe de presente de seu tio o Um Anel, um anel mágico e maligno que precisa ser destruído antes que caia nas mãos do mal. Para isso o hobbit Frodo (Elijah Woods) terá um caminho árduo pela frente, onde encontrará perigo, medo e personagens bizarros. Ao seu lado para o cumprimento desta jornada aos poucos ele poderá contar com outros hobbits, um elfo, um anão, dois humanos e um mago, totalizando 9 pessoas que formarão a Sociedade do Anel."
"11","3","5","Um jovem (Michael J. Fox) aciona acidentalmente uma máquina do tempo construída por um cientista (Christopher Lloyd) em um Delorean, retornando aos anos 50. Lá conhece sua mãe (Lea Thompson), antes ainda do casamento com seu pai, que fica apaixonada por ele. Tal paixão põe em risco sua própria existência, pois alteraria todo o futuro, forçando-o a servir de cupido entre seus pais."
"10","3","1","Após a captura de Merry (Dominic Monaghan) e Pippy (Billy Boyd) pelos orcs, a Sociedade do Anel é dissolvida. Enquanto que Frodo (Elijah Wood) e Sam (Sean Astin) seguem sua jornada rumo à Montanha da Perdição para destruir o Um Anel, Aragorn (Viggo Mortensen), Legolas (Orlando Bloom) e Gimli (John Rhys-Davies) partem para resgatar os hobbits sequestrados."
"5","0","0","Philippe (François Cluzet) é um aristocrata rico que, após sofrer um grave acidente, fica tetraplégico. Precisando de um assistente, ele decide contratar Driss (Omar Sy), um jovem problemático que não tem a menor experiência em cuidar de pessoas no seu estado. Aos poucos ele aprende a função, apesar das diversas gafes que comete. Philippe, por sua vez, se afeiçoa cada vez mais a Driss por ele não tratá-lo como um pobre coitado. Aos poucos a amizade entre eles se estabele, com cada um conhecendo melhor o mundo do outro."
"2","3","9","Cinco anos após convencer os habitantes de seu vilarejo que os dragões não devem ser combatidos, Soluço (voz de Jay Baruchel) convive com seu dragão Fúria da Noite, e estes animais integraram pacificamente a rotina dos moradores da ilha de Berk. Entre viagens pelos céus e corridas de dragões, Soluço descobre uma caverna secreta, onde centenas de novos dragões vivem. O local é protegido por Valka (voz de Cate Blanchett), mãe de Soluço, que foi afastada do filho quando ele ainda era um bebê. Juntos, eles precisarão proteger o mundo que conhecem do perigoso Drago Bludvist (Djimon Hounson), que deseja controlar todos os dragões existentes."
"11","3","10","As forças imperais comandadas por Darth Vader (David Prowse) lançam um ataque contra os membros da resistência, que são obrigados a fugir. Enquanto isso Luke Skywalker (Mark Hamill) tenta encontrar o Mestre Yoda, que poderá ensiná-lo a dominar a 'Força' e torná-lo um cavaleiro jedi. No entanto, Darth Vader planeja levá-lo para o lado negro da 'Força'."
"7","0","0","Jackson, pequena cidade no estado do Mississipi, anos 60. Skeeter (Emma Stone) é uma garota da sociedade que retorna determinada a se tornar escritora. Ela começa a entrevistar as mulheres negras da cidade, que deixaram suas vidas para trabalhar na criação dos filhos da elite branca, da qual a própria Skeeter faz parte. Aibileen Clark (Viola Davis), a emprega da melhor amiga de Skeeter, é a primeira a conceder uma entrevista, o que desagrada a sociedade como um todo. Apesar das críticas, Skeeter e Aibileen continuam trabalhando juntas e, aos poucos, conseguem novas adesões."
"2","5","9","Riley é uma garota divertida de 11 anos de idade, que deve enfrentar mudanças importantes em sua vida quando seus pais decidem deixar a sua cidade natal, no estado de Minnesota, para viver em San Francisco. Dentro do cérebro de Riley, convivem várias emoções diferentes, como a Alegria, o Medo, a Raiva, o Nojinho e a Tristeza. A líder deles é Alegria, que se esforça bastante para fazer com que a vida de Riley seja sempre feliz. Entretanto, uma confusão na sala de controle faz com que ela e Tristeza sejam expelidas para fora do local. Agora, elas precisam percorrer as várias ilhas existentes nos pensamentos de Riley para que possam retornar à sala de controle - e, enquanto isto não acontece, a vida da garota muda radicalmente."
"3","1","11","Décadas após a queda de Darth Vader e do Império, surge uma nova ameaça: a Primeira Ordem, uma organização sombria que busca minar o poder da República e que tem Kylo Ren (Adam Driver), o General Hux (Domhnall Gleeson) e o Líder Supremo Snoke (Andy Serkis) como principais expoentes. Eles conseguem capturar Poe Dameron (Oscar Isaac), um dos principais pilotos da Resistência, que antes de ser preso envia através do pequeno robô BB-8 o mapa de onde vive o mitológico Luke Skywalker (Mark Hamill). Ao fugir pelo deserto, BB-8 encontra a jovem Rey (Daisy Ridley), que vive sozinha catando destroços de naves antigas. Paralelamente, Poe recebe a ajuda de Finn (John Boyega), um stormtrooper que decide abandonar o posto repentinamente. Juntos, eles escapam do domínio da Primeira Ordem."
"7","0","0","Parker Wilson (Richard Gere) é um professor universitário que, ao retornar do trabalho, encontra na estação de trem um filhote de cachorro da raça akita, conhecido por sua lealdade. Sem ter como deixá-lo na estação, Parker o leva para casa mesmo sabendo que Cate (Joan Allen), sua esposa, é contra a presença de um cachorro. Aos poucos Parker se afeiçoa ao filhote, que tem o nome Hachi escrito na coleira, em japonês. Cate cede e aceita sua permanência. Hachi cresce e passa a acompanhar Parker até a estação de trem, retornando ao local no horário em que o professor está de volta. Até que um acontecimento inesperado altera sua vida."
"14","5","0","Inglaterra, 1797. As cinco irmãs Bennet - Elizabeth (Keira Knightley), Jane (Rosamund Pike), Lydia (Jena Malone), Mary (Talulah Riley) e Kitty (Carey Mulligan) - foram criadas por uma mãe (Brenda Blethyn) que tinha fixação em lhes encontrar maridos que garantissem seu futuro. Porém Elizabeth deseja ter uma vida mais ampla do que apenas se dedicar ao marido, sendo apoiada pelo pai (Donald Sutherland). Quando o sr. Bingley (Simon Woods), um solteiro rico, passa a morar em uma mansão vizinha, as irmãs logo ficam agitadas. Jane logo parece que conquistará o coração do novo vizinho, enquanto que Elizabeth conhece o bonito e esnobe sr. Darcy (Matthew Macfadyen). Os encontros entre Elizabeth e Darcy passam a ser cada vez mais constantes, apesar deles sempre discutirem."
"0","0","0","Django (Jamie Foxx) é um escravo liberto cujo passado brutal com seus antigos proprietários leva-o ao encontro do caçador de recompensas alemão Dr. King Schultz (Christoph Waltz). Schultz está em busca dos irmãos assassinos Brittle, e somente Django pode levá-lo a eles. O pouco ortodoxo Schultz compra Django com a promessa de libertá-lo quando tiver capturado os irmãos Brittle, vivos ou mortos.Ao realizar seu plano, Schultz libera Django, embora os dois homens decidam continuar juntos. Desta vez, Schultz busca os criminosos mais perigosos do sul dos Estados Unidos com a ajuda de Django. Dotado de um notável talento de caçador, Django tem como objetivo principal encontrar e resgatar Broomhilda (Kerry Washington), sua esposa, que ele não vê desde que ela foi adquirida por outros proprietários, há muitos anos.A busca de Django e Schultz leva-os a Calvin Candie (Leonardo DiCaprio), o dono de 'Candyland', uma plantação famosa pelo treinador Ace Woody, que treina os escravos locais para a luta. Ao explorarem o local com identidades falsas, Django e Schultz chamam a atenção de Stephen (Samuel L. Jackson), o escravo de confiança de Candie. Os movimentos dos dois começam a ser traçados, e logo uma perigosa organização fecha o cerco em torno de ambos. Para Django e Schultz conseguirem escapar com Broomhilda, eles terão que escolher entre independência e solidariedade, sacrifício e sobrevivência."
"7","0","0","Carl Brashear (Cuba Gooding Jr.) veio de uma humilde família negra, que vivia em uma área rural em Sonora, Kentucky. Ainda garoto, no início dos anos 40, já adorava mergulhar, sendo que quando jovem se alistou na Marinha esperando se tornar um mergulhador. Inicialmente Carl trabalha como cozinheiro que era uma das poucas tarefas permitidas a um negro na época. Quando resolve mergulhar no mar em uma sexta-feira acaba sendo preso, pois os negros só podiam nadar na terça-feira, mas sua rapidez ao nadar é vista por todos e assim se torna um 'nadador de resgate', por iniciativa do capitão Pullman (Powers Boothe). Quando Brashear solicita a escola de mergulhadores encontra o comandante Billy Sunday (Robert De Niro), um instrutor de mergulho áspero e tirânico que tem absoluto poder sobre suas decisões. No princípio Sunday faz muito pouco para encorajar as ambições de Brashear e o aspirante a mergulhador descobre que o racismo no exército é um fato quando os outros aspirantes brancos - exceto Snowhill (Michael Rapaport), que por isto foi perseguido por Sunday - se negam a compartilhar um alojamento com um negro. Mas a coragem e determinação de Brashear impressionam Sunday e os dois se tornam amigos quando Brashear tem de lutar contra o preconceito e a burocracia militar, que quer acabar com seus sonhos de se tornar comandante e reformá-lo."
"15","0","0","A agente do FBI, Clarice Starling (Jodie Foster) é ordenada a encontrar um assassino que arranca a pele de suas vítimas. Para entender como ele pensa, ela procura o periogoso psicopata, Hannibal Lecter (Anthony Hopkins), encarcerado sob a acusação de canibalismo."
"1","11","3","Em 2029, Logan (Hugh Jackman) ganha a vida como chofer de limousine para cuidar do nonagenário Charles Xavier (Patrick Stewart). Debilitado fisicamente e esgotado emocionalmente, ele é procurado por Gabriela (Elizabeth Rodriguez), uma mexicana que precisa da ajuda do ex-X-Men para defender a pequena Laura Kinney / X-23 (Dafne Keen). Ao mesmo tempo em que se recusa a voltar à ativa, Logan é perseguido pelo mercenário Donald Pierce (Boyd Holbrook), interessado na menina."
"1","3","11","Tentanto proteger o planeta de ameaças como as vistas no primeiro Os Vingadores, Tony Stark busca construir um sistema de inteligência artifical que cuidaria da paz mundial. O projeto acaba dando errado e gera o nascimento do Ultron (voz de James Spader). Capitão América (Chris Evans), Homem de Ferro (Robert Downey Jr.), Thor (Chris Hemsworth), Hulk (Mark Ruffalo), Viúva Negra (Scarlett Johansson) e Gavião Arqueiro (Jeremy Renner) terão que se unir para mais uma vez salvar o dia."
"12","7","0","Ao desembarcar na Normandia, no dia 6 de junho de 1944, capitão Miller (Tom Hanks) recebe a missão de comandar um grupo do segundo batalhão para o resgate do soldado James Ryan, caçula de quatro irmãos, dentre os quais três morreram em combate. Por ordens do chefe George C. Marshall, eles precisam procurar o soldado e garantir o seu retorno, com vida, para casa."
"11","3","10","O imperador (Ian McDiarmid) está supervisionando a construção de uma nova Estrela da Morte. Enquanto isso Luke Skywalker (Mark Hamill) liberta Han Solo (Harrison Ford) e a Princesa Leia (Carrie Fisher) das mãos de Jaba, o pior bandido das galáxias. Luke só se tornará um cavaleiro jedi quando destruir Darth Vader, que ainda pretende atraí-lo para o lado negro da 'Força'. No entanto a luta entre os dois vai revelar um inesperado segredo."
"6","4","0","Em 1969, após tentar se suicidar, Hunter Adams (Robin Williams) voluntariamente se interna em um sanatório. Ao ajudar outros internos, descobre que deseja ser médico, para poder ajudar as pessoas. Deste modo, sai da instituição e entra na faculdade de medicina. Seus métodos poucos convencionais causam inicialmente espanto, mas aos poucos vai conquistando todos, com exceção do reitor, que quer arrumar um motivo para expulsá-lo, apesar dele ser o primeiro da turma."
"7","0","0","Jack (Edward Norton) é um executivo jovem, trabalha como investigador de seguros, mora confortavelmente, mas ele está ficando cada vez mais insatisfeito com sua vida medíocre. Para piorar ele está enfrentando uma terrível crise de insônia, até que encontra uma cura inusitada para o sua falta de sono ao frequentar grupos de auto-ajuda. Nesses encontros ele passa a conviver com pessoas problemáticas como a viciada Marla Singer (Helena Bonham Carter) e a conhecer estranhos como Tyler Durden (Brad Pitt). Misterioso e cheio de ideias, Tyler apresenta para Jack um grupo secreto que se encontra para extravasar suas angústias e tensões através de violentos combates corporais."
"3","4","12","No século XIII, soldados ingleses matam a mulher do escocês William Wallace (Mel Gibson), bem na sua noite de núpcias. Para vingar a amada, ele resolve liderar seu povo em uma luta contra o cruel Rei inglês Edward I (Patrick McGoohan). Com a ajuda de Robert e Bruce, ele vai deflagrar uma violenta batalha com o objetivo de libertar a Escócia de uma vez por todas."
"3","7","1","Nos dias finais do reinado de Marcus Aurelius (Richard Harris), o imperador desperta a ira de seu filho Commodus (Joaquin Phoenix) ao tornar pública sua predileção em deixar o trono para Maximus (Russell Crowe), o comandante do exército romano. Sedento pelo poder, Commodus mata seu pai, assume a coroa e ordena a morte de Maximus, que consegue fugir antes de ser pego e passa a se esconder sob a identidade de um escravo e gladiador do Império Romano."
"2","9","14","Em uma pequena aldeia da França vive Belle, uma jovem inteligente que é considerada estranha pelo moradores da localidade, e seu pai, Maurice, um inventor que é visto como um louco. Ela é cortejada por Gaston, que quer casar com ela. Mas apesar de todas as jovens do lugarejo o acharem um homem bonito, Belle não o suporta, pois vê nele uma pessoa primitiva e convencida. Quando o pai de Belle vai para uma feira demonstrar sua nova invenção, ele acaba se perdendo na floresta e é atacado por lobos. Desesperado, Maurice procura abrigo em um castelo, mas acaba se tornando prisioneiro da Fera, o senhor do castelo, que na verdade é um príncipe que foi amaldiçoado por uma feiticeira quando negou abrigo a ela. Quando Belle sente que algo aconteceu ao seu pai vai à sua procura. Ela chega ao castelo e lá faz um acordo com a Fera: se seu pai fosse libertado ela ficaria no castelo para sempre. A Fera concorda e todos os 'moradores' do castelo, que lá vivem e também foram transformados em objetos falantes, sentem que esta pode ser a chance do feitiço ser quebrado. Mas isto só acontecerá se a Fera amar alguém e esta pessoa retribuir o seu amor, sendo que isto tem de ser rápido, pois quando a última pétala de uma rosa encantada cair o feitiço não poderá ser mais desfeito."
"10","3","0","O 3º ano de ensino na Escola de Magia e Bruxaria de Hogwarts se aproxima. Porém um grande perigo ronda a escola: o assassino Sirius Black (Gary Oldman) fugiu da prisão de Azkaban, considerada até então como à prova de fugas. Para proteger a escola são enviados os Dementadores, estranhos seres que sugam a energia vital de quem se aproxima deles, que tanto podem defender a escola como piorar ainda mais a situação."
"13","0","0","Vincent Vega (John Travolta) e Jules Winnfield (Samuel L. Jackson) são dois assassinos profissionais trabalham fazendo cobranças para Marsellus Wallace (Ving Rhames), um poderosos gângster. Vega é forçado a sair com a garota do chefe, temendo passar dos limites; enquanto isso, o pugilista Butch Coolidge (Bruce Willis) se mete em apuros por ganhar luta que deveria perder."
